руководитель отдела продаж автомобилей,хостес,специалист по продажам пластиковых карт,руководитель отдела внутреннего контроля,экономист на производство,директор контрактного производства,something very long,главный инженер ппбу,something very long,руководитель группы госпитальных продаж,something very long,системный инженер,фотограф-репортажник,технический аккаунт менеджер,продуктовый аналитик,провизор на склад,something very long,ученик мастера по ремонту бытовой техники,менеджер по проектным продажам,начальник цеха,механик по транспорту,ночной администратор фитнес-клуба,визовый специалист,инженер по вентиляции и кондиционированию,менеджер отдела продаж,специалист визового отдела,администратор магазина love republic
руководитель отдела продаж,специалист,специалист по взысканию задолженности,охранник лицензированный в бц лахта,экономист по труду и заработной плате,директор компании,something very long,главный инженер проектов,something very long,руководитель отдела закупа,something very long,html-верстальщик,фотограф-дизайнер в фотосалон,менеджер учебного центра,аналитик по продажам,лазеротерапевт,something very long,хостес в бар-клуб,коммерческий директор,техник-механик,уборщик салонов самолетов в шереметьево,начинающий специалист по работе с клиентами,ведущий юрисконсульт отдела судебной работы,инженер по водоснабжению и канализации,технический директор проекта,помощник официанта в загородный ресторан,senior technical recruiter
руководитель отдела запасных частей,специалист визового центра,ведущий менеджер по привлечению клиентов малого бизнеса,сотрудник охраны офисного здания,оператор отдела по работе с клиентами,директор киноцентра,something very long,главный инженер шахты,something very long,стартап-менеджер,something very long,тестировщик мобильных приложений,фотограф-дизайнер,менеджер управления методологии риск-менеджмента и внутреннего контроля,аналитик по продукту,медицинская сестра,something very long,something very long,продавец-консультант в ортопедический салон,ведущий технолог,техник-отделочник,мужской стилист,ведущий эксперт по урегулированию убытков,инженер по замерам  замерщик,семейный водитель,повар в ресторан,администратор магазина befree
руководитель одного из направлений,переводчик английского языка,премиум менеджер,специалист по взысканию,ведущий экономист,директор ит в г. лобня,something very long,главный механик,something very long,специалист\ менеджер отдела закупок,something very long,.net разработчик,фотограф цветов и букетов,программист-консультант 1с,мерчендайзер по районам,врач – педиатр дежурный   москва,бюджетного учета,работник торгового зала,продавец в салон обуви,менеджер по организации судового питания,токарь-расточник,менеджер торгового сектора,ведущий финансовый консультант,инженер по календарно-сетевому планированию,специалист по планированию,старший официант,супервайзер промоутеров
слесарь по ремонту грузового транспорта,курьер-экспедитор,заместитель управляющего дополнительным офисом,специалист отдела взыскания,бухгалтер-консультант,директор ит,something very long,ведущий инженер-механик,something very long,специалист управления по закупкам,something very long,специалист службы поддержки пользователей,фотограф на теплоход,продавец-консультант мужских костюмов,арт-директор,медицинская сестра по физиотерапии,ведущий аналитик,региональный представитель по корпоративным клиентам,менеджер по работе с постоянными клиентами,эксперт,разнорабочий в аэропорт шереметьево,мужской парикмахер,ведущий специалист управления розничных продаж,инженер по надзору за зданиями и сооружениями,координатор,сомелье,управляющий магазином
слесарь по ремонту двигателей,корпоративный водитель,специалист операционного отдела,специалист отдела секретного делопроизводства службы защиты государственной тайны,экономист отдела ценообразования,директор дивизиона с переездом,something very long,ведущий инженер службы релейной защиты и автоматики,something very long,специалист управления организации производства товаров собственных торговых марок,something very long,devops engineer,стилист-консультант онлайн опенинг,стажер sap,арт- директор,врач-гастроэнтеролог,копирайтер,продавец,руководитель направления продаж,наладчик станка с чпу,санитарка,менеджер торгового сектора,ведущий специалист по урегулированию убытков,инженер по обслуживанию систем вентиляции и кондиционирования,водитель категории d,старший официант,администратор магазина
слесарь по ремонту дизельных двс,координатор со знанием финского языка,ведущий финансовый консультант,специалист отдела предотвращения потерь,оператор по работе с первичной бухгалтерской документацией,директор департамента закупок,something very long,ведущий инженер проектирования электродвигателей,something very long,руководитель отдела закупок и логистики,something very long,специалист по тестированию,стилист-консультант в большой,специалист отдела регламентации и оптимизации бизнес-процессов,менеджер по продажам рекламы и работе с клиентами,врач узд,методист,специалист по взаимодействию с клиентами,продавец продовольственных товаров,инженер – технолог сборочно-испытательного цеха \ инженер-технолог механосборочного цеха,работник на фабрику мороженого,мужской мастер,ведущий специалист по работе с партнерами,инженер по пожарной безопасности,сток-менеджер,менеджер кофейни,старший специалист отдела кадров
слесарь по ремонту наземного транспорта,координатор со знанием английского языка,заместитель руководителя дополнительного офиса,специалист отдела предотвращения внештатных ситуаций,ведущий специалист по мсфо,директор департамента it,something very long,procurement analyst,something very long,руководитель отдела производства сувенирной продукции,something very long,python developer,ретушер,руководитель проектного офиса,мобильный мерчендайзер с функцией подменного,заведующая аптекой,ai team lead,продавец -кассир,ассистент менеджера по продажам,инженер по смк,сборщик,менеджер торгового сектора спорт с ракетками,ведущий специалист по работе с бсо,инженер по работе с проектными организациями,водитель - экспедитор на личном грузовом автомобиле,старший повар,executive it recruiter
специалист по подбору запасных частей,координатор продаж,инвестиционный консультант,специалист отдела обеспечения транспортной безопасности автостанции,ведущий специалист по методологии учета,директор гастронома,something very long,буровой мастер,something very long,руководитель по закупкам и контрактации,something very long,devops,стилист-консультант,руководитель проектного отдела,аналитик-маркетолог,заведующий аптечным складом,something very long,something very long,кассир-консультант swatch,эксперт по сертификации,уборщик-посудомойщик,менеджер смены,ведущий специалист отдела урегулирования убытков по личному страхованию,инженер по ремонту,кладовщик-комплектовщик,подсобный рабочий на кухню в загородный ресторан,something very long
специалист по осмотру автомобилей,специалист по обработке документов,главный эксперт,специалист отдела досудебного взыскания,бухгалтер-финансист,директор по закупкам и логистике,something very long,контролер зиф,something very long,руководитель проекта департамента организации и методологии закупочной деятельности,something very long,frontend разработчик,руководитель отдела маркетинга и рекламы,специалист отдела серверных приложений,младший маркетолог-аналитик,врач травматолог-ортопед,rnd,стажёр в области клинических исследований,продавец- кассир «мясницкий ряд»,маляр,продавец-кассир,менеджер фитнес проектов \ project manager,ведущий специалист отдела урегулирования убытков,something very long,водитель по перевозке опасных грузов,администратор на ресепшен,learning and development manager
специалист по логистике,координатор проектов,руководитель отделения банка,"специалист отдела взыскания в группу ""field""",операционист-бухгалтер,директор по закупкам сельскохозяйственных культур,something very long,начальник отдела в управляющую компанию,something very long,руководитель тендерного отдела,something very long,оператор технической поддержки,руководитель отдела игристых вин,специалист первой линии технической поддержки,ивент-менеджер,медицинский советник,e-mail маркетолог,стажёр департамента долевого строительства,кассир кафе,повар,электромонтер по ремонту и монтажу кабельных линий,младший администратор салона красоты,ведущий специалист отдела страхования имущества,инженер по техническому контролю,транспортный диспетчер,повар на теплоход,внутренний тренер
специалист по лизингу,специалист по кадровому делопроизводству,руководитель направления,специалист кро,руководитель группы по методологической поддержке сметной экспертизы,директор по инвестициям,something very long,специалист по топографии,something very long,руководитель товарного направления,something very long,project manager,руководитель отдела дизайна,руководитель проекта по реализации вычислительной техники и компьютерного оборудования,младший маркетолог,гастроэнтеролог,english language instructor,менеджер торгового сектора,представитель компании в китае,оператор газовой котельной,фасовщица  икры,менеджер-консультант контактного центра,ведущий специалист отдела сопровождения корпоративных продаж,инженер по техническому надзору,специалист по организации перевозок,бариста-кассир,администратор  магазина mothercare  тц вегас крокус
специалист по качеству,менеджер call-центра,старший аналитик,сотрудник службы безопасности и контроля,something very long,директор по производству,something very long,something very long,something very long,руководитель товарного направления сезонных товаров,something very long,программист oracle,ретушер - дизайнер,руководитель проекта по направлению корпоративной отчетности,пресс-секретарь,врач профпатолог,data scientist,something very long,старший менеджер по работе с ключевыми заказчиками,слесарь-инструментальщик,техник-электрик с опытом работы по рекламному оборудованию,менеджер-администратор м.филевский парк,ведущий специалист отдела рассмотрения претензий,техник-лаборант,водитель грузового транспорта,кассир в ресторан,something very long
специалист по диагностике и электрике,менеджер администратор автосервиса,старший менеджер отдела продаж,специалист контрольно-ревизионного отдела,ведущий специалист отдела методологии учета,директор по франчайзингу,something very long,something very long,something very long,специалист по ценообразованию,something very long,менеджер,дизайнер сайтов,руководитель по запуску новых проектов в пищевой отрасли,ux дизайнер мобильных приложений,заведующий аптечным учреждением,автор научных и студенческих работ по искусствоведению и истории,промоутер,продавец-консультант магазина tom tailor,технолог производства,мастер леса,менеджер фитнес-клуба по продажам,врач-эксперт качества медицинской помощи службы экспертизы и защиты прав застрахованных,техник пто,водитель погрузочно-разгрузочной техники,администратор магазина-бара,ведущий hr-специалист
специалист по выкупу автомобилей с пробегом,специалист по обработке первичной документации,руководитель по активным продажам,специалист группы оперативного мониторинга в такси,руководитель группы административной поддержки,директор по транспорту,something very long,something very long,something very long,специалист по торгам и закупкам,something very long,программист -разработчик 1с,редактор сайта,специалист по валидации компьютеризированных систем,"консультант городской мобильной информационной службы ""я знаю город""",акушер,something very long,администратор-кассир,менеджер по туризму,кузнец на молотах и прессах,техник-электрик,менеджер-администратор,врач-эксперт отдела медицинской экспертизы по договорам личного страхования,специалист департамента по контролю за строительством на предприятиях гк,менеджер по логистике и таможенному оформлению,менеджер ресторана kfc,hr бизнес-партнёр
специалист по выдаче транспортных средств,менеджер без поиска клиентов,главный специалист по ипотечному кредитованию,специалист группы оперативного контроля,помощник бухгалтера,директор по транспортной логистике,something very long,associate sales coordinator,something very long,секретарь отдела,something very long,php разработчик,редактор медицинских новостей,специалист по внедрению 1с,бренд-медиа менеджер,ассистент стоматолога,linguistic quality engineer,оператор-консультант,продавец кассир,технолог производства,маркировщик,персональный тренер тренажёрного зала,выездной специалист по ипотечному страхованию,инженер производственно-технического отдела,водитель погрузчика-грузчик,менеджер кафе,эксперт по подбору персонала
специалист отдела логистики,специалист по маркетингу и коммуникациям,руководитель проектов,специалист в отдел безопасности,ведущий бухгалтер по учету основных средств,директор по разработкам,something very long,control systems design engineer,something very long,снабжение производства,something very long,android разработчик,редактор для вычитки технических переводов,менеджер по стандартизации бизнес-процессов,мобильный мерчендайзер p&g,косметолог,manager,продавец,агроном,ведущий инженер по качеству,помощник команд-участников чемпионата мира по футболу,менеджер-администратор,главный специалист направления ипотечного страхования,техник по вентиляции и кондиционированию,специалист по вэд,повар в школу,эксперт по подбору и оценке персонала
специалист инженерной группы,специалист активных продаж,директор дополнительного офиса,специалист в области защиты окружающей среды,продавец-кассир,директор по развитию транспортной компании,something very long,customer service specialist,something very long,специалист по торгам,something very long,программист 1c,редактор городского сообщества вконтакте,специалист по качественным исследованиям,бренд-директор,медицинская сестра в косметологии,marketing analytics lead,продавец-консультант,продавец-кассир «мясницкий ряд»,менеджер по техническому развитию,прессовщик,something very long,главный специалист отдела обслуживания,инженер-сметчик,руководитель отдела продаж,руководитель отдела маркетинга и рекламы,эксперт по оплате труда
сотрудник гоночной трассы,специалист по кадровому делопроизводству,инвестиционный консультант,сотрудница группы быстрого реагирования,помощник старшего бухгалтера,директор по развитию продаж и взаимодействию с ключевыми клиентами,something very long,fmm  drafting engineer,something very long,специалист  отдела снабжения,something very long,программист 1c,редактор online-издания,специалист по корпоративной культуре,конструктор-чертежник,специалист по стандартизации и сертификации,math analyst in data transmission,something very long,региональный менеджер по обучению и развитию,ведущий специалист смк,маляр по дереву,something very long,главный специалист отдела методологии и андеррайтинга осаго,слесарь-сантехник обходчик,something very long,посудомойщица,hr-менеджер
