механик по выпуску автомобилей,товаровед супермаркета,оператор в сектор тестовых обзвонов,главный специалист,бухгалтер в садовый центр,руководитель в отдел рекламы,something very long,машинист пкс,something very long,помощник менеджера отдела обеспечения,специалист по техническому обслуживанию оборудования,ui дизайнер,актриса,scrum master,ведущий специалист по маркетингу,участковый,тренер по художественной гимнастике и хореографии для детей,something very long,специалист отдела продаж,упаковщица,разносчик на стадион,визажист- бровист,something very long,инженер-конструктор отдела проектных и конструкторских работ,водитель,территориальный управляющий,менеджер по обучению и развитию
механик по выпуску,администратор ресторана,менеджер по работе с риелторами и застройщиками,"специалист по охране труда, пожарной безопасности и гражданской обороне",something very long,руководитель группы колл-центра,something very long,something very long,something very long,"продакт менеджер по товарному направлению ""дверная фурнитура""",младший инженер технической поддержки,инженер,something very long,специалист сервисного центра,менеджер по маркетингу  рекламе и pr,главный врач,тренер-инструктор по роликовым конькам,something very long,территориальный представитель по торговому маркетингу,ведущий инженер-технолог,слесарь кипиа,визажист м.а.с.,something very long,главный архитектор,персональный водитель на чемпионат мира по футболу,хостес в ресторан иль патио,hr generalist
механик по выпуску,уборщик офисных помещений,специалист по обслуживанию физических лиц,ревизор видеонаблюдения,начальник финансового отдела,руководитель группы материально-технического обеспечения и хозяйственного обслуживания,something very long,машинист погрузчика,something very long,техник по учету в отдел снабжения,мастер по ремонту стиральных машин и бытовой техники,инженер-программист 1с,крупье,менеджер по организации продаж,менеджер по продажам и работе с клиентами,врач - педиатр участковый,уборщик лабораторного комплекса,инженер-технолог,территориальный менеджер по продажам,технолог общественного питания,наладчик оборудования,пармейстер-банщик,something very long,инженер-конструктор,водитель-курьер,something very long,консультант
региональный менеджер,старший администратор,менеджер прямых продаж,руководитель группы пожарной безопасности и охраны объектов,начальник экономического отдела,руководитель департамента ит,something very long,эксперт по инспектированию и приемке оборудования,something very long,продакт,менеджер сервисного центра,программист java,лингвист,менеджер по развитию agile-проектов,менеджер проектов,оптометрист,устный переводчик английского языка,интернет-маркетолог,торговый агент,мастер участка,швея,продавец-консультант,something very long,помощник оценщика,специалист по работе с клиентами,шеф-повар,hr business partner
региональный торговый представитель,переводчик с китайского языка,менеджер по работе с вип-клиентами,помощник генерального директора,бухгалтер по ос и тмц,начальник производства наружной рекламы,something very long,машинист подземной самоходной машины,something very long,продавец-кассир,инженер опс,senior python developer,модельер,scrum-тренер ,маркетолог-дизайнер с функциями smm,врач детский хирург,устный переводчик арабского языка,крупье,оператор азс,укладчик-упаковщик,упаковщик,консультант,something very long,инженер технического надзора,ведущий специалист по безопасности,старший повар,менеджер по внутренним коммуникациям
механик отк и по,инспектор отдела кадров,специалист казначейства,региональный менеджер по взысканию задолженности г. коломна,бухгалтер \ консультант 1-с,руководитель департамента продаж,something very long,функциональный архитектор в области интегрированных операций,something very long,помощник руководителя по закупкам,главный инженер проектов,front-end developer,шеф аниматоров,технический эксперт,something very long,врач,устный переводчик французского языка,курьер - водитель,менеджер по развитию,электромонтер по ремонту и обслуживанию электрооборудования,слесарь мср на турбинку,инструктор водного комплекса,региональный руководитель управления агентских продаж,дизайнер-визуализатор,специалист по транспортной логистике,помощник официанта,менеджер по компенсациям и льготам
механик сектора,специалист контакт-центра,управляющий дополнительным офисом,охранник на разные объкты,оператор 1с по поступлению,руководитель дирекции стандартизации и качества,something very long,"машинист бульдозера в ао ""печоранефтегаз""",something very long,помощник руководителя по закупкам и вэд,главный энергетик,разработчик t-sql,автор,спикер,something very long,врач-консультант,учитель английского языка,модель,продавец непродовольственных товаров,механик,сортировщик,менеджер по продажам косметологического оборудования,региональный менеджер по подбору и адаптации персонала,ведущий инженер-электрик,водитель самосвала,заместитель директора ресторана,экономист по труду
начальник смены шинного центра,водитель службы доставки с личным автомобилем,менеджер по развитию агентской сети,охранник на производство,бухгалтер - калькулятор,руководитель отдела маркетинга и корпоративных коммуникаций,something very long,машинист сбу,something very long,помощник руководителя тендерного отдела,дефектоскопист рентгенногаммаграфирования,менеджер проектов,сценарист,senior consultant,менеджер по работе с партнерами,дерматовенеролог,учитель английского языка в частную школу,something very long,заведующий магазином,начальник лаборатории,мерчендайзер-грузчик,бровист,руководитель направления по интернет-продажам,монтажник пвх-окон,водитель-курьер,администратор отеля,менеджер по обучению и развитию персонала
механик сервиса,администратор суши wok,менеджер по работе с физическими и юридическими лицами,охранн⁢ик⁢ кпп,делопроизводитель,руководитель диспетчерской службы,something very long,машинист экскаватора эш - 20,something very long,провизор,заместитель руководителя группы сервисного обслуживания,тестировщик,швея,релиз-менеджер,офис-менеджер,хирург,учитель биологии,something very long,контролер торгового зала,менеджер проектов,монтажник рэа и приборов,парикмахер в салон,руководитель направления по работе с агентами,заместитель директора по продажам,водитель автосамосвала,администратор мини-отеля,главный врач многопрофильной медицинской клиники
оператор автомойки,помощник менеджера,менеджер в отделение банка,охранник на планерную улицу,менеджер по автоматизации бухгалтерского учета,руководитель интернет-магазина,something very long,флотатор,something very long,претензионист,инженер выездного сервисного центра по ремонту бытовой техники lg,руководитель проектов,танцовщик эксклюзивной танцевальной шоу-программы,senior consultant,ведущий менеджер по маркетингу и рекламе,врач-терапевт участковый,учитель венгерского языка,something very long,менеджер,ведущий инженер по летным испытаниям авиационного оборудования вс,транспортировщик,бармен,региональный куратор департамента урегулирования убытков,главный эксперт строительного контроля,водитель автобуса регулярных пассажирских маршрутов,администратор-кассир в пекарню,начальник отдела методологии организации и оплаты труда
оператор 1с,ассистент генерального директора,кредитный представитель,охранник на объект газпрома,консультант по программам 1с,руководитель направления,something very long,начальник базы по взрывным работам,something very long,"продакт менеджер по товарному направлению ""сантехника""",инженер ккт,менеджер интернет-проектов,ux дизайнер,специалист по бизнес-процессам,something very long,заведующий аптеки,учитель индоевропейского языка,секретарь на телефон,продавец-консультант в магазин зоотоваров,начальник цеха,автослесарь,барбер,руководитель агентской группы,инженер-строитель,водитель с личным автомобилем,директор пиццерии,ведущий экономист по труду
руководитель группы по работе с партнерами,специалист административно-хозяйственного отдела,специалист по обслуживанию клиентов,охранник на объект,казначей,руководитель направления ит,something very long,финансовый контролер проекта,something very long,специалист по контрактам,инженер монтажных и пуско-наладочных работ,разработчик qlikview,web-дизайнер,старший консультант   группа повышения операционной эффективности,something very long,ревизор,учитель истории,менеджер,менеджер по продажам horeca,термист,техник,координатор тренажерного зала,something very long,менеджер по продажам недвижимости,ведущий специалист,менеджер доставки,рекрутер на массовый подбор линейных сотрудников
начальник отдела по работе с лизинговыми компаниями,уборщик,менеджер по работе с малым и средним бизнесом,помощник руководителя службы безопасности,консультант 1с в отдел сопровождения,руководитель направления корпоративного университета,something very long,участковый геолог,something very long,оператор бд,инженер отдела сервиса и ремонта,php программист,ux designer,agile coach,руководитель отдела маркетинга и рекламы,медицинский регистратор,учитель истории и обществознания,специалист по сбору информации,начальник смены азс,конструктор одежды,автомойщик,преподаватель танцев,руководитель центра управления портфелем,менеджер по продажам недвижимости,кладовщик-грузчик,повар линии раздачи,специалист по обучению
оператор call-центра,курьер пеший,ведущий экономист,ревизор видеонаблюдения со знанием английского языка,оператор 1c,руководитель направления маркетинговых коммуникаций,something very long,менеджер отдела снабжения,something very long,экономист отдела закупок,something very long,аналитик 1с,менеджер по организации рекламных образовательных проектов фармация – медицина,senior consultant organizational development and industry 4.0.,менеджер по связям с общественностью,врач-уролог,учитель начальных классов,менеджер интернет-проектов,специалист по работе с клиентами,инженер-электрик,столяр,инструктор тренажерного зала,автоэксперт,инженер-электрик,водитель на автомобиле компании,"су-шеф в ресторан ""иль патио""",главный менеджер по подбору персонала
оператор call-центра интернет-магазина,оператор интернет-магазина,риск-менеджер,ревизор видеонаблюдения,оператор по вводу данных,руководитель направления по внешнему оформлению магазинов,something very long,менеджер по аналитике рынков,something very long,эксперт по сертификации,инженер по лабораторному оборудованию,qa automation engineer,младший редактор со знанием английского языка,специалист отдела продаж и клиентского сервиса,smm специалист,врач клинико-диагностической лаборатории,учитель химии  биологии,something very long,товаровед,заместитель директора по животноводству,турбинист,администратор-управляющий,something very long,инженер-электромеханик,водитель с личным грузовым автомобилем,продавец,специалист по обучению персонала
начальник кузовного цеха,администратор ветеринарной клиники,главный финансовый консультант,руководитель группы предотвращения потерь,бухгалтер на участок,руководитель направления по работе с ключевыми клиентами,something very long,мастер участка добычи  подготовки и отгрузки нефти и газа,something very long,менеджер по сырьевому обеспечению,инженер по наладке и испытаниям контрольно-измерительного оборудования,ведущий специалист,модельер-конструктор кожгалантереи,старший менеджер по развитию бизнес-процессов финансового блока,младший специалист по контекстной рекламе,врач-стоматолог детский,учитель-методист  по химии,менеджер кинотеатра,торговый представитель сети,специалист по ремонту электроники,сверловщик-слесарь,персональный тренер тренажерного зала,специалист управления выплат по личному страхованию,главный инженер проекта,водитель-курьер с личным автомобилем,швейцар,начальник отдела управления персоналом
начальник автоколонны   механик,делопроизводитель,территориальный менеджер,руководитель группы экономической безопасности,бухгалтер-специалист вэд,cio,something very long,машинист электровоза,something very long,менеджер по товародвижению,инженер по обслуживанию багажных систем и конвейерных установок,ui,визажист,программист - стажер,интернет-маркетолог онлайн-сервиса,врач-педиатр   ликино-дулево,химик,something very long,специалист по продажам,главный энергетик,сборщик корпусной,оператор-кассир,старший оценщик недвижимости и оборудования,инженер-проектировщик слаботочных систем,начальник смены,something very long,ведущий специалист по развитию и обучению в учебный центр
начальник автоколонны,администратор на ресепшн,специалист отделения банка,руководитель контрольно-ревизионного отдела,бухгалтер по расчету заработной платы,руководитель продукта,something very long,системный администратор,something very long,менеджер по управлению товарными запасами,инженер по обслуживанию банковских устройств самообслуживания,инженер по тестированию,флорист,research manager,верстальщик,врач-педиатр  подольск,химик аналитик,младший специалист,менеджер по развитию,инженер-конструктор рза кру,кладовщик-комплектовщик,педикюра,старший менеджер клиентского зала,главный архитектор проекта,менеджер по транспорту,заведующий столовой,главный методолог системы развития кадрового потенциала атомной отрасли
моторист - дизелист,водитель-охранник,оценщик,охранник на массовые мероприятия,бухгалтер по кадровому учету и расчету заработной платы,руководитель отдела маркетинга и рекламы,something very long,начальник бурового судна,something very long,менеджер по экспорту,инженер по обслуживанию медицинской техники,менеджер по работе с клиентами,младший дизайнер,cтарший менеджер проекта департамента организационного развития,something very long,специалист по регистрации лекарственных средств,химик-аналитик,менеджер отдела снабжения,key account manager,инженер - релейщик,рад охнвп,массажист-эстетист в спа-студию,старший врач-эксперт,инженер технического надзора,старший диспетчер,повар столовой,заместитель управляющего магазином
мойщик-полировщик автомобилей,translator,оператор по работе с клиентами,пожарной безопасности,бухгалтер по товародвижению,управляющий гостиничным комплексом,something very long,региональный менеджер по продажам в страны снг,something very long,эксперт по закупке оборудования,инженер по обслуживанию слаботочных систем,back-end developer,something very long,специалист поддержки 1с,ui,лаборант в клинико-диагностическую лабораторию,хранитель славянской культуры,сотрудник парковки,супервайзер,заведующий производством,электрогазосварщик накс рд,руководитель отдела продаж,специалист центра пролонгации договоров автострахования,инженер тгв  овик,кладовщик-комплектовщик,портье,операционный менеджер розничной сети
