Автомобильный бизнес,Административный персонал,"Банки, инвестиции, лизинг",Безопасность,"Бухгалтерия, управленческий учет, финансы предприятия",Высший менеджмент,"Государственная служба, некоммерческие организации",Добыча сырья,Домашний персонал,Закупки,Инсталляция и сервис,"Информационные технологии, интернет, телеком","Искусство, развлечения, масс-медиа",Консультирование,"Маркетинг, реклама, PR","Медицина, фармацевтика","Наука, образование","Начало карьеры, студенты",Продажи,Производство,Рабочий персонал,"Спортивные клубы, фитнес, салоны красоты",Страхование,"Строительство, недвижимость","Транспорт, логистика","Туризм, гостиницы, рестораны","Управление персоналом, тренинги"
механик,офис-менеджер,кредитный специалист,охранник,бухгалтер,коммерческий директор,судебный пристав по обеспечению установленного порядка деятельности судов,руководитель отдела охраны труда,горничная,менеджер по закупкам,монтажник,системный администратор,швея-портной,бизнес-аналитик,маркетолог,медицинская сестра,переводчик,начинающий специалист отдела входящих обращений,оператор,токарь,разнорабочий,массажист,специалист по страхованию,сварщик-аргонщик,кладовщик,официант,менеджер по персоналу
автослесарь,оператор сектора электронных обращений,менеджер по привлечению юридических лиц,полицейский,главный бухгалтер,директор ресторана,something very long,старший геолог,няня,специалист по закупкам,сервисный инженер,программист 1с,дизайнер,руководитель проекта,smm-менеджер,фармацевт,учитель английского языка,стажер,менеджер по продажам,оператор станков,грузчик,мастер ногтевого сервиса,страховой агент,слесарь мср,водитель-экспедитор,повар,менеджер по подбору персонала
мастер-приемщик,оператор call-центра,торговый представитель в банк,полицейский,бухгалтер по расчету заработной платы,директор филиала,чиновник,водитель-оператор сзм,сиделка,менеджер по закупкам,сервисный инженер,специалист поддержки,графический дизайнер,руководитель проектов,интернет-маркетолог,медицинская сестра   москва,преподаватель английского языка,стажер,торговый представитель,фрезеровщик,токарь,косметолог,директор агентства,сварщик,водитель,официант,специалист по подбору персонала
маляр,секретарь,менеджер по работе с клиентами,охранник,заместитель главного бухгалтера,директор по маркетингу,президент,водитель-экспедитор,домработница,категорийный менеджер,системный инженер,аналитик,фотограф,бизнес-тренер,промоутер,медицинская сестра,учитель русского языка и литературы,работник ресторана kfc,продавец-консультант,наладчик станков с чпу,комплектовщик,парикмахер,менеджер по продажам,отделочник,водитель такси,менеджер по туризму,специалист по кадрам
автомеханик,помощник руководителя,специалист отдела входящих обращений,специалист по работе с заемщиками,экономист,ведущий специалист-методолог,менеджер по страхованию,мастер дробильного отделения зиф,помощник по хозяйству,менеджер по снабжению,инженер кипиа,специалист технической поддержки,танцовщица,менеджер проектов,менеджер по продажам услуг,медсестра,data scientist,бармен,продавец-кассир,инженер-конструктор,слесарь,визажист,руководитель отдела продаж,электромонтажник,менеджер по логистике,менеджер ресторана,специалист по кадровому делопроизводству
менеджер по продажам,курьер,специалист в банк,специалист по взысканию просроченной задолженности,бухгалтер,руководитель представительства в китае,специалист поддержки пользователей,водитель автомобиля по перевозке средств инициирования,гувернер,категорийный менеджер,слесарь кипиа,frontend-разработчик,менеджер кинотеатра,руководитель проекта,контент-менеджер,провизор,доцент кафедры теории и методики циклических видов спорта,продавец-кассир,продавец-консультант,инженер-технолог,фрезеровщик,администратор салона красоты,оператор по продаже страхования от несчастных случаев,прораб,водитель,бармен,рекрутер
автоэлектрик,администратор,оператор контактного центра,специалист по взысканию задолженности,помощник бухгалтера,директор филиала тд вимос,специалист линии консультаций,ведущий участковый маркшейдер,садовник,менеджер отдела закупок,инженер,программист,бренд - менеджер,специалист-аналитик,менеджер по маркетингу,врач-оториноларинголог,доцент кафедры теории и методики гимнастики и борьбы,продавец-консультант,менеджер по работе с клиентами,менеджер по закупкам,сварщик-аргонщик накс,парикмахер-универсал,менеджер по работе с клиентами,инженер пто,диспетчер,повар горячего цеха,специалист отдела кадров
слесарь по ремонту автомобилей,специалист по подбору персонала,специалист департамента взыскания,ревизор,бухгалтер на первичную документацию,руководитель отдела продаж,руководитель фотокружка,главный энергетик,гувернантка,ведущий специалист по закупкам,мастер ремонтно-механической мастерской,программист 1c,флорист,менеджер проекта,маркетолог-аналитик,врач акушер-гинеколог,преподаватель в кружок робототехники,начинающий специалист,торговый представитель,инженер-конструктор,уборщица,парикмахер-стилист,менеджер по страхованию,электромонтер,водитель погрузчика,повар-универсал,менеджер по персоналу
менеджер по продажам автозапчастей,водитель,кредитный инспектор отдела верификации,оператор видеонаблюдения,финансовый менеджер,заведующий производством,руководитель библиотечного центра,заместитель начальника службы пб и от в части производственного контроля,помощница,заместитель руководителя отдела управления товарным запасом,инженер-монтажник,инженер технической поддержки,графический дизайнер,специалист колл-центра,менеджер по рекламе,врач-терапевт,менеджер по продажам,транспортировщик,менеджер по продажам,слесарь-электрик по ремонту электрооборудования,уборщик,менеджер по продажам,руководитель группы прямых продаж,слесарь-ремонтник,водитель-экспедитор,кондитер,тренинг-менеджер
автоэлектрик-диагност,водитель-курьер,кредитный инспектор отдела верификации департамента рисков,руководитель регионального подразделения,бухгалтер-кассир,директор по развитию,"руководитель ""клуба любителей кино""",начальник пто,домработник,специалист по закупкам,регулировщик рэа и приборов,менеджер по продажам,дизайнер-консультант фотоуслуг и фототоваров в копицентр,консультант 1с,менеджер по работе с клиентами,провизор,доцент кафедры теории и методики спортивных игр,оператор call-центра,продавец-кассир,инженер-технолог,шлифовщик,мастер маникюра и педикюра,специалист по урегулированию претензий,инженер-сметчик,водитель автобуса,повар,начальник отдела логистики
моторист,оператор пк,оператор отдела верификации,специалист по работе с исполнительным производством,бухгалтер-калькулятор,исполнительный директор,market access manager,съемщик доводчик,воспитатель,менеджер по продажам,инженер-электрик со знанием английского языка,web-программист,ui,бизнес-аналитик,копирайтер,фармацевт-провизор,воспитатель детей дошкольного возраста,официант в ресторан иль патио,мерчендайзер,технолог,мастер,администратор,ведущий специалист по страхованию,специалист по охране труда,логист,су-шеф,hr менеджер
менеджер по продажам автозапчастей,хостес,оператор отдела телемаркетинга,контролер торгового зала,ведущий бухгалтер,директор лесопильного завода,председатель,ведущий инженер,домработница,менеджер по закупкам и снабжению,инженер технической поддержки,ведущий программист 1с,аниматор,старший консультант,pr-менеджер,фармацевт-провизор,преподаватель русского языка и литературы,экономист-логист в отдел закупок,оператор по продаже банковских продуктов,оператор станков с чпу,грузчик,мастер маникюра,менеджер агентской группы,инженер-проектировщик,водитель такси,повар холодного цеха,бизнес-тренер
шлифовщик,секретарь на ресепшен,специалист отдела телемаркетинга,специалист по охране труда и технике безопасности,финансовый директор,управляющий фитнес-клубом,менеджер по доступу препаратов на рынок,инженер-геодезист,something very long,менеджер по снабжению,системный аминистратор,системный аналитик,танцовщик,something very long,менеджер по маркетингу и рекламе,врач-педиатр участковый,учитель математики,менеджер по продажам,медицинский представитель,инженер,кладовщик-комплектовщик,мастер ногтевого сервиса,главный специалист отдела розничных продаж,менеджер по развитию,кладовщик,бармен-кассир,директор по персоналу
продавец-консультант,специалист по документообороту,промоутер тинькофф мобайл,региональный начальник опп,старший бухгалтер,генеральный директор,менеджер отдела по связям с государственными структурами,инженер по охране труда и промышленной безопасности,something very long,руководитель товарного направления,сетевой инженер,программист 1с,дизайнер-верстальщик,something very long,дизайнер,врач анестезиолог-реаниматолог,научный сотрудник,бармен,менеджер по оптовым продажам,шлифовщик,грузчик-комплектовщик,инструктор тренажёрного зала,специалист по страхованию,слесарь-сборщик,специалист по логистике,бариста,менеджер по подбору персонала
механик по ремонту горного и автортанспортного оборудования,администратор медицинского центра,начинающий специалист отдела входящих обращений,охранник торгового зала,финансовый аналитик,директор по маркетингу  рекламе и pr,главный эксперт сектора капитального строительства администрации,ведущий инженер пто,персональный  водитель,специалист по тендерам,инженер-дефектоскопист в отдел внутритрубной диагностики и ремонта,php-разработчик,дизайнер,something very long,мерчендайзер,ветеринарный врач,педагог-воспитатель,оператор колл-центра,руководитель отдела продаж,главный инженер,упаковщик,тренер тренажерного зала,специалист по корпоративным продажам,инженер-проектировщик,водитель автомобиля,пекарь,менеджер ресторана
автослесарь,секретарь,операционист,специалист по работе с просроченной задолженностью,главный бухгалтер,заместитель исполнительного директора,главный специалист сектора архитектуры,буровой мастер,персональный водитель,специалист отдела закупок,специалист по защите информации,senior java developer,редактор,something very long,менеджер отдела продаж,медицинская сестра процедурной,кадровый представитель школы на кафедре иностранных языков,промоутер,медицинский представитель,оператор производственной линии,электрик,мастер маникюра,начальник отдела корпоративных продаж,главный энергетик,сотрудник склада,шеф-повар,рекрутер
продавец-консультант по автотоварам,делопроизводитель,консультант,специалист по охране труда,кассир,директор по информационным технологиям,something very long,инженер строительного контроля,повар-универсал,менеджер отдела закупок,инженер слаботочных систем,инженер-программист,фоторедактор,менеджер,бренд - менеджер,медицинская сестра-анестезист,редактор-переводчик английского языка,something very long,кассир,инженер по качеству,слесарь-сборщик,инструктор тренажерного зала,менеджер активных продаж,менеджер по продаже жилой недвижимости,заведующий складом,хостес,начальник отдела кадров
инженер по ремонту,секретарь-референт,менеджер по работе с корпоративными клиентами,специалист службы экономической безопасности,заместитель главного бухгалтера,управляющий комбинатом пищевого производства,архивариус,эксперт по закупкам,водитель для семьи со знанием английского языка,ассистент менеджера по закупкам,инженер по обслуживанию pos терминалов,тестировщик по,редактор газеты,руководитель проектов,тайный покупатель,акушер,заведующий кафедрой теории и методики тенниса и бадминтона,менеджер кинотеатра,менеджер по работе с ключевыми клиентами,инженер,машинист погрузчика,мастер по наращиванию ресниц,something very long,инженер пто,водитель категории е,администратор-кассир,руководитель отдела персонала
шиномонтажник,водитель-курьер,менеджер по продажам,контролер торгового зала выходного дня,ведущий экономист,директор по закупкам,менеджер по работе с государственными органами власти,инженер технического надзора,вожатый,ассистент отдела закупок,инженер по обслуживанию pos-терминалов,web-разработчик,корректор,системный аналитик,трейд-маркетолог,врач-статистик,менеджер по работе с клиентами,стажер дирекции по закупкам и логистике,менеджер по работе с клиентами,something very long,подсобный рабочий,массажист,something very long,слесарь-сантехник,водитель такси vw jetta,менеджер ресторана,ассистент менеджера по персоналу
мойщик автомобилей,менеджер по работе с клиентами,промоутер,специалист по пожарной безопасности,старший кассир,коммерческий директор,something very long,машинист подъемника,няня-воспитатель,руководитель отдела закупок,something very long,java-разработчик,ретушер,менеджер по продажам,мерчендайзер,врач-инфекционист в отделение интенсивной терапии,биолог,стажёр-специалист в компанию нипигаз,мерчендайзер,менеджер по продажам,машинист экскаватора,администратор фитнес-клуба,менеджер по работе со страховыми агентами,инженер-строитель,менеджер по продажам,продавец-кассир,ведущий менеджер по подбору персонала
автомаляр,представитель в банк,рекрутер,инженер по охране труда и технике безопасности,финансовый менеджер,директор по продажам,something very long,машинист буровой установки roc,клинер,кладовщик,сервис-инженер,системный администратор,ux,консультант,мобильный мерчендайзер,медицинский статистик,ведущий биотехнолог,бармен в ресторан иль патио,оператор-кассир азс,инженер-химик,продавец-кассир,инструктор групповых программ,руководитель агентства,специалист инженерных сетей,менеджер по вэд,повар-сушист,hr-специалист
менеджер по продажам,секретарь руководителя,кредитный специалист,ведущий специалист по пожарной безопасности,аудитор,менеджер по продажам,something very long,металлург,логопед,координатор отдела закупок,инженер по техническому обслуживанию систем безопасности,инженер-программист,дизайнер интерьеров,консультант,маркетолог,врач-педиатр   москва,ведущий микробиолог,инженер-технолог,менеджер по работе с ключевыми клиентами,главный технолог,токарь-фрезеровщик,менеджер отдела продаж,ведущий специалист,слесарь кипиа,водитель электропогрузчика,бармен,рекрутер
