ведущий менеджер отдела продаж,оператор на входящие звонки,менеджер прямых продаж,ведущий инженер отдела информационной безопасности,бухгалтер на банк-клиент в отдел казначейства,менеджер проектов,something very long,директор департамента металлургического производства,something very long,senior procurement specialist,something very long,разработчик с++,работа с социальными сетями,test automation engineer,специалист направления закупок,врач - пульмонолог,something very long,продавец-консультант в арт-галерею со знанием французского языка,руководитель группы по привлечению корпоративных клиентов,наладчик производственного оборудования,сборщик урожая,something very long,начальник отдела по работе с конкурсами и тендерами,энергоаудитор,водитель-курьер на личном автомобиле,пиццайоло,эксперт отдела hr отчетности
администратор портфеля,продавец-кассир суши wok,специалист по обучению и адаптации сотрудников,ведущий инженер,бухгалтер на зуп и ндс,менеджер по работе с салонами тайского спа,something very long,заведующий лабораторией цементных растворов,something very long,senior country buyer,something very long,региональный менеджер по продажам оборудования,помощник руководителя,technical support engineer,media buyer,специалист по регистрации медицинских изделий,something very long,продавец-консультант в магазины mothercare  в бц преображенский,менеджер по продажам нефтепродуктов,инженер по подготовке производства,оператор складского учета,something very long,начальник отдела анализа и актуарной оценки,главный инженер по эксплуатации,начальник склада,"бармен в ресторан ""американский бар и гриль""",эксперт  разработка обучающих программ
администратор,помощник менеджера по персоналу,менеджер по работе с корпоративными клиентами крупного бизнеса,ведущий администратор зала,бухгалтер на участок «поставщики и покупатели»,менеджер по работе с клиентами в клинику,something very long,заведующий складом взрывчатых материалов,something very long,requisitioner,something very long,разработчик мобильных приложений,монтажер,technical support engineer,руководитель отдела торгового маркетинга,медицинская сестра  в клинику,something very long,промоутер по раздаче листовок,продавец-консультант в incanto,специалист проектно-конструкторского отдела,рабочий убойного цеха,тренер-универсал групповых программ,менеджер по развитию бизнеса,ведущий инженер отдела капитального строительства и капитального ремонта,ночной контролер на склад,сотрудник ресторана \ restaurant co-worker,эксперт  корпоративное обучение и управление знаниями
агрегатчик,переводчик,менеджер по работе с партнерами,инженер по технике безопасности,заместитель финансового директора,менеджер по работе с клиентами,something very long,заместитель главного геолога,something very long,purchasing specialist,something very long,android-developer,менеджер проекта,summer internship - operations transformation group - consulting department,маркетолог-дизайнер,специалист по валидации,something very long,работник ресторана kfc 3d,менеджер корпоративных продаж,инженер-инспектор,машинист сваебойной установки,тренер-технолог,something very long,ведущий специалист по материально-техническому обеспечению,инженер,сотрудник ресторана,региональный управляющий северо-западный регион
автоэлектрик-диагност,операционный менеджер,главный кредитный аналитик малого бизнеса,инженер по техническим системам охраны и безопасности,аудитор департамента международной отчетности,менеджер по привлечению инвестиций,something very long,заместитель директора по производству,something very long,purchasing manager,something very long,ведущий программист c#,менеджер по продукту,senior сonsultant,marketing manager,врач узд,something very long,продавец-консультант в магази⁢н в motherca⁢r⁢e,something very long,инженер-прочнист,сборщик турбин,тренер-реабилитолог,менеджер центра обслуживания клиентов,главный специалист по геофизическим исследованиям,инженер летно-технической эксплуатации вс,фаршесоставитель,региональный тренер
автослесарь-воздушник по обслуживанию и ремонту грузовых автомобилей,оператор-диспетчер,специалист по поддержке юридических лиц,инженер пожарной охраны,специалист по расчету заработной платы,заместитель операционного директора сети ресторанов,something very long,заместитель заведующего лабораторией цементных растворов,something very long,procurement manager,something very long,консультант sap sd,креативный дизайнер,senior research executive,product менеджер со знанием английского языка,врач-терапевт на 0 5 ставки,something very long,руководитель проектов,продавец-консультант в магазины mothercare,наладчик оборудования в пищевой промышленности,механик по ремонту и обслуживанию холодильного оборудования,тренер-инструктор тренажёрного зала,менеджер проекта,главный специалист по инженерно-геодезическим изысканиям,инженер планировщик,финансовый куратор,региональный менеджер по подбору и адаптации персонала
автоэлектрик по установке gps-глонасс,ведущий специалист группы протокольного сопровождения и контроля,главный клиентский менеджер по работе с корпоративными клиентами,оперативный дежурный,бухгалтер на участок клиент-банк,заместитель начальника отдела экспедирования,something very long,something very long,something very long,field buyer,something very long,веб-разработчик wordpress php,кассир в салон керамической плитки kerama marazzi,senior project manager,менеджер по цифровому маркетингу,врач стоматолог-терапевт,something very long,работник ресторана kfc атмосфера,территориальный менеджер,эксперт   г.свободный,рабочий на производство и склад,тренер-инструктор по единоборствам,менеджер по страхованию,ведущий инженер ов и вк,водитель-экспедитор на нашем автомобиле,помощник менеджера по туризму,управляющий полноформатным магазином victoria's secret
автоэлектрик по ремонту автокранов и спецтехники,оператор службы поддержки со знанием испанского языка,специалист по привлечению клиентов,something very long,бухгалтер на участок банк  касса  авансовые отчеты,заместитель начальника отдела продаж,something very long,something very long,something very long,директор аптеки,something very long,machine learning,дизайнера,senior consultant with business valuation group,сборщик рекламных конструкций,врач терапевт,something very long,продавец-консультант в арт-галерею со знанием японского языка,мобильный кассир,наладчик оборудования,разнорабочий на строительство,тренер-инструктор в женский фитнес-клуб,something very long,главный специалист по методологии капитального строительства,инженер по орнитологическому обеспечению полетов,сотрудник кухни,региональный менеджер по подбору
автоэлектрик на грузовую сто,переводчик   мурманск,главный клиентский менеджер по обслуживанию юридических лиц,something very long,бухгалтер на участок заработная плата,директор сборочного производства,something very long,something very long,something very long,директор по закупкам,something very long,backend-разработчик,дизайнер,менеджер по сопровождению клиентов,hr senior manager,провизор-технолог,something very long,работник ресторана kfc дунайский,администратор отдела продаж,инженер по охране труда и технике безопасности,стокер,тренер тренажёрного зала,менеджер по развитию продаж,ведущий специалист отдела реализации инвестиционных программ,помощник менеджера по логистике,хостес в караоке-бар,управляющий рестораном
автоэлектрик,оператор сканирования данных,главный клиентский менеджер отдела малого бизнеса,something very long,специалист по сверке,директор филиала  управляющий,something very long,something very long,something very long,менеджер по работе с тендерами,something very long,ведущий разработчик,хостес,senior business system analyst,менеджер департамента маркетинга и развития,процедурная медицинская сестра,something very long,продавец интернет-магазина,продавец-консультант одежды,руководитель швейного производства,наладчик кузнечно-прессового оборудования,тренер тренажерного зала world class каширский,менеджер по добровольному медицинскому страхованию,главный геодезист,помощник менеджера по логистике,сотрудник кофейни,региональный менеджер по обучению
автоэксперт- менеджер по подбору авто,переводчик-администратор,менеджер премиального сегмента,something very long,старший консультант по управленческому учету и бюджетированию,директор филиала,something very long,something very long,something very long,менеджер по закупкам со знанием английского языка,something very long,frontend разработчик wordpress,видеомонтажер,scrum-мастер,копирайтер smm,врач-травматолог-ортопед,something very long,продавец сети пекарен-булочных,администратор на ресепшен,специалист по транспортной логистике,мойщица,тренер студии pilates,менеджер отдела страхования и кредитования,ведущий специалист по работе с ключевыми клиентами,водитель участников чемпионата мира по футболу,обвальщик мяса,управляющий розничной сетью
автослесарь-моторист грузового сервиса,персональный ассистент к управляющему директору,менеджер по работе с франшизами,дежурный видеонаблюдения,аудитор - аналитик,директор учебного центра,something very long,something very long,something very long,менеджер по закупкам на производство,something very long,bi developer,администратор парка виртуальных развлечений arenaspace,sap бизнес-аналитик,менеджер по работе с клиентами в школе программирования игр кодабра,продавец-консультант медицинских изделий,something very long,продавец- консультант,менеджер проектов,формовщик колбасных изделий,оператор-программист фрезерно-гравировального станка с чпу,стилист-парикмахер,менеджер отдела продаж  new x-fit химки,руководитель проекта,инженер по техническому надзору,засольщик мяса,управляющий смены
автослесарь-колодочник,персональный водитель,менеджер по развитию бизнеса потребительского кредитования,оператор видеонаблюдения со знанием английского языка,менеджер по продажам,директор торгового дома,something very long,something very long,something very long,менеджер по закупкам и складскому учету,something very long,веб-разработчик,web designer,sap hybris consultant,менеджер по работе с клиентами в клинику,врач-трихолог,something very long,продавец-администратор,администратор в магазин косметики,начальник участка асутп,"работник торгового зала ""военторг-пятерочка""",стилист по волосам,главный специалист по урегулированию убытков,главный специалист пто,водитель топливозаправщика,официант в ресторан иль патио,управляющий суши-бара
консультант по подбору автомобилей,персональный менеджер,специалист по продажам банковских услуг,оперативный сотрудник,специалист по сверкам,директор супермаркета,something very long,something very long,something very long,менеджер по закупкам и продажам сельхозпродукции,something very long,администратор 1с,web - дизайнер,product owner,something very long,продавец-консультант оптики,something very long,руководитель проекта,менеджер по продукту,нормировщик по материалам,разнорабочий на склад,стилист,диспетчер центра клиентского сопровождения,ведущий специалист,помощник менеджера по вэд,повар-кондитер,управляющий торговой точки суши wok
контролер технического состояния автомобилей,помощник администратора,менеджер по связям с инвесторами,ночной ревизор контрольно-ревизионного отдела,директор по экономике и финансам,директор супермаркета,something very long,something very long,something very long,менеджер по закупкам и продажам лома цветных металлов,something very long,инженер-программист с++,smm-менеджер,product manager,оператор по шелкографии на производство,врач-остеопат  мануальный терапевт,something very long,продавец-кассир в магазин игрушек imaginarium,менеджер по развитию клиентов,инженер-конструктор 1 категории,"работник тогового зала ""военторг-пятерочка""",руководитель отдела продаж.,диспетчер медицинской службы дмс,ведущий инженер по вводу земель в эксплуатацию и мелиорации,руководитель отдела доставки,менеджер по индивидуальному туризму,управляющий универмагом
механик дорожно-строительной техники,оператор по аккредитации,менеджер по работе с клиентами мсб,начальник отдела режима,аудитор-эксперт,директор розничной сети мебельных салонов,something very long,something very long,something very long,менеджер по закупкам и продажам вторсырья,something very long,консультант call-центра,smm-копирайтер,something very long,менеджер по работе с клиентами в медицинский центр,врач стоматолог-терапевт-ортопед,something very long,работник ресторана kfc нарва,продавец-консультант в фотомагазин,бухгалтер по расчету заработной платы,станочник широкого профиля,руководитель отдела продаж в фитнес-клуб,диспетчер аварийных комиссаров,ведущий менеджер проектов,водитель телескопического погрузчика,хостес в ресторан,тренинг-менеджер по продажам
менеджер по продажам услуг автобизнеса,помощник бухгалтера,менеджер холодных продаж,ночной охранник в пышечную,бухгалтер на участок касса,директор филиала страховой компании,something very long,something very long,something very long,менеджер по закупкам и логистике группы horeсa,something very long,it project manager,project manager,olap,менеджер-координатор группы полевых сотрудников,врач-трансфузиолог,something very long,работник ресторана kfc петроградская,менеджер активных продаж мгтс,конструктор,слесарь механосборочных работ,руководитель отдела продаж в фитнес клуб,директор по продажам,ведущий инженер по строительному контролю,водитель-инкассатор,менеджер отеля,практикант в отдел персонала
менеджер по продажам и работе с партнерами,помощник коммерческого директора,специалист по кредитованию юридических лиц,начальник управления пэб  от и гз,старший менеджер по учету,директор розничной сети,something very long,something very long,something very long,менеджер по закупкам драгоценных металлов,something very long,инженер по сопровождению фронт-офисных систем,event manager,mobile product manager,начальник управления внутренних коммуникаций,врач стоматолог-хирург,something very long,продавец-кассир в салон,вечерний продавец love republic,инженер по валидации,мотальщик,руководитель отдела продаж в премиальный фитнес-клуб,главный специалист управления партнерских продаж,ведущий специалист по охране труда,ночной кладовщик,директор департамента корпоративных продаж,практика в отделе кадров лизинговой компании
менеджер по продажам запчастей,оператор отдела контроллинга,главный менеджер по работе с корпоративными клиентами,начальник сторожевой группы,старший налоговый консультант,директор ресторана сети быстрого питания,something very long,something very long,something very long,менеджер по закупкам вэд,something very long,ведущий консультант sap bw,технический дизайнер,manager with strategy&operations group,оператор связи на чм по футболу fifa 2018,заведующий кабинетом - врач-рефлексотерапевт,something very long,продавец-консультант выходного дня zarina,продавец-консультант в пункт выдачи заказов,инженер по автоматизации,сервисный электромеханик,руководитель отдела по работе с клиентами,главный специалист подразделения партнерских продаж,главный специалист отдела проектных и конструкторских работ,кассир в экспресс павелецкого направления,директор гостинично-развлекательного комплекса,управляющий⁢ булочной
